<?xml version="1.0" encoding="UTF-8"?>
<tns:RequestHeaderOutMessage xmlns:tns="http://www.grupobancolombia.com/BandaDigital/services/SHP_MSG_ESB" xmlns:xsi="http://www.w3.org/2001/XMLSchema-instance" xsi:schemaLocation="http://www.grupobancolombia.com/BandaDigital/services/SHP_MSG_ESB ../resources/SHP_MSG_ESB.xsd ">
  <tns:requestHeaderOut>
    <tns:Header>
      <tns:systemId>tns:systemId</tns:systemId>
      <tns:messageId>tns:messageId</tns:messageId>
      <tns:invokerDateTime>tns:invokerDateTime</tns:invokerDateTime>
      <tns:securityCredential>
        <tns:userName>tns:userName</tns:userName>
        <tns:userToken>tns:userToken</tns:userToken>
      </tns:securityCredential>	
      <tns:destination>
        <tns:name>tns:name</tns:name>
        <tns:namespace>tns:namespace</tns:namespace>
        <tns:operation>tns:operation</tns:operation>
      </tns:destination>
      <tns:messageContext>
      	<tns:property>
      		<tns:key></tns:key>
      		<tns:value></tns:value>
      	</tns:property>
      	<tns:property>
      		<tns:key></tns:key>
      		<tns:value></tns:value>
      	</tns:property>
      </tns:messageContext>
    </tns:Header>
    <tns:Body/>
  </tns:requestHeaderOut>
</tns:RequestHeaderOutMessage>
